161-173 sdcard_sd: bit_0: "0"
173-185 sdcard_sd: bit_1: "1"
185-197 sdcard_sd: bit_0: "0"
197-209 sdcard_sd: bit_0: "0"
209-221 sdcard_sd: bit_1: "1"
221-233 sdcard_sd: bit_0: "0"
233-245 sdcard_sd: bit_0: "0"
245-257 sdcard_sd: bit_0: "0"
257-269 sdcard_sd: bit_0: "0"
269-281 sdcard_sd: bit_0: "0"
281-293 sdcard_sd: bit_0: "0"
293-305 sdcard_sd: bit_0: "0"
305-317 sdcard_sd: bit_0: "0"
317-329 sdcard_sd: bit_0: "0"
329-341 sdcard_sd: bit_0: "0"
341-353 sdcard_sd: bit_0: "0"
353-365 sdcard_sd: bit_0: "0"
365-377 sdcard_sd: bit_0: "0"
377-389 sdcard_sd: bit_0: "0"
389-401 sdcard_sd: bit_0: "0"
401-413 sdcard_sd: bit_0: "0"
413-425 sdcard_sd: bit_0: "0"
425-437 sdcard_sd: bit_0: "0"
437-449 sdcard_sd: bit_0: "0"
449-461 sdcard_sd: bit_0: "0"
461-473 sdcard_sd: bit_0: "0"
473-485 sdcard_sd: bit_0: "0"
485-497 sdcard_sd: bit_0: "0"
497-509 sdcard_sd: bit_0: "0"
509-521 sdcard_sd: bit_0: "0"
521-533 sdcard_sd: bit_0: "0"
533-545 sdcard_sd: bit_1: "1"
545-557 sdcard_sd: bit_0: "0"
557-569 sdcard_sd: bit_1: "1"
569-581 sdcard_sd: bit_0: "0"
581-593 sdcard_sd: bit_1: "1"
593-605 sdcard_sd: bit_1: "1"
605-617 sdcard_sd: bit_0: "0"
617-629 sdcard_sd: bit_1: "1"
629-641 sdcard_sd: bit_0: "0"
641-653 sdcard_sd: bit_1: "1"
653-665 sdcard_sd: bit_0: "0"
665-677 sdcard_sd: bit_0: "0"
677-689 sdcard_sd: bit_1: "1"
689-701 sdcard_sd: bit_1: "1"
701-713 sdcard_sd: bit_0: "0"
713-725 sdcard_sd: bit_1: "1"
725-737 sdcard_sd: bit_1: "1"
161-173 sdcard_sd: field-start: "Start bit" "Start" "S"
173-185 sdcard_sd: field-transmission: "Transmission: host" "T: host" "T"
185-257 sdcard_sd: field-cmd: "Command: SEND_IF_COND (8)" "Cmd: SEND_IF_COND (8)" "CMD8" "Cmd" "C"
257-641 sdcard_sd: field-arg: "Argument: 0x0000015a" "Arg" "A"
641-725 sdcard_sd: field-crc: "CRC: 0x4d" "CRC" "C"
725-737 sdcard_sd: field-end: "End bit" "End" "E"
257-497 sdcard_sd: decoded-field: "Reserved" "Res" "R"
497-545 sdcard_sd: decoded-field: "Supply voltage" "Voltage" "VHS" "V"
545-641 sdcard_sd: decoded-field: "Check pattern" "Check pat" "Check" "C"
161-737 sdcard_sd: cmd8: "CMD8 (SEND_IF_COND): Send interface condition to card" "CMD8 (SEND_IF_COND)" "CMD8"
773-785 sdcard_sd: bit_0: "0"
785-797 sdcard_sd: bit_0: "0"
797-809 sdcard_sd: bit_0: "0"
809-821 sdcard_sd: bit_0: "0"
821-833 sdcard_sd: bit_1: "1"
833-845 sdcard_sd: bit_0: "0"
845-857 sdcard_sd: bit_0: "0"
857-869 sdcard_sd: bit_0: "0"
869-881 sdcard_sd: bit_0: "0"
881-893 sdcard_sd: bit_0: "0"
893-905 sdcard_sd: bit_0: "0"
905-917 sdcard_sd: bit_0: "0"
917-929 sdcard_sd: bit_0: "0"
929-941 sdcard_sd: bit_0: "0"
941-953 sdcard_sd: bit_0: "0"
953-965 sdcard_sd: bit_0: "0"
965-977 sdcard_sd: bit_0: "0"
977-989 sdcard_sd: bit_0: "0"
989-1001 sdcard_sd: bit_0: "0"
1001-1013 sdcard_sd: bit_0: "0"
1013-1025 sdcard_sd: bit_0: "0"
1025-1037 sdcard_sd: bit_0: "0"
1037-1049 sdcard_sd: bit_0: "0"
1049-1061 sdcard_sd: bit_0: "0"
1061-1073 sdcard_sd: bit_0: "0"
1073-1085 sdcard_sd: bit_0: "0"
1085-1097 sdcard_sd: bit_0: "0"
1097-1109 sdcard_sd: bit_0: "0"
1109-1121 sdcard_sd: bit_0: "0"
1121-1133 sdcard_sd: bit_0: "0"
1133-1145 sdcard_sd: bit_0: "0"
1145-1157 sdcard_sd: bit_1: "1"
1157-1169 sdcard_sd: bit_0: "0"
1169-1181 sdcard_sd: bit_1: "1"
1181-1193 sdcard_sd: bit_0: "0"
1193-1205 sdcard_sd: bit_1: "1"
1205-1217 sdcard_sd: bit_1: "1"
1217-1229 sdcard_sd: bit_0: "0"
1229-1241 sdcard_sd: bit_1: "1"
1241-1253 sdcard_sd: bit_0: "0"
1253-1265 sdcard_sd: bit_0: "0"
1265-1277 sdcard_sd: bit_0: "0"
1277-1289 sdcard_sd: bit_0: "0"
1289-1301 sdcard_sd: bit_0: "0"
1301-1313 sdcard_sd: bit_1: "1"
1313-1325 sdcard_sd: bit_1: "1"
1325-1337 sdcard_sd: bit_1: "1"
1337-1349 sdcard_sd: bit_1: "1"
773-785 sdcard_sd: field-start: "Start bit" "Start" "S"
785-797 sdcard_sd: field-transmission: "Transmission: card" "T: card" "T"
797-869 sdcard_sd: field-cmd: "Command: SEND_IF_COND (8)" "Cmd: SEND_IF_COND (8)" "CMD8" "Cmd" "C"
869-1253 sdcard_sd: field-arg: "Argument: 0x0000015a" "Arg" "A"
1253-1337 sdcard_sd: field-crc: "CRC: 0x7" "CRC" "C"
1337-1349 sdcard_sd: field-end: "End bit" "End" "E"
773-1349 sdcard_sd: response_r7: "Response: R7"
869-1109 sdcard_sd: decoded-field: "Reserved" "Res" "R"
1109-1157 sdcard_sd: decoded-field: "Voltage accepted: 2.7-3.6V" "Voltage" "Volt" "V"
1157-1253 sdcard_sd: decoded-field: "Echo-back of check pattern" "Echo" "E"
